Category,Topic,Ranking
Conditions & Forecast,Understand wave size, direction, period and sets
Conditions & Forecast,Understand the wind effect on waves
Conditions & Forecast,Understand the tides effect on waves
Conditions & Forecast,Can look at a forecast and understand how the conditions will be like according to the spot and the tides
Conditions & Forecast,Can look at the conditions and understand where the waves are breaking, where is the channel and how are the currents
Conditions & Forecast,Can imagine what kind of maneuvers will I be able to do in the waves that I intend to surf
Conditions & Forecast,Can assess how many waves I'll be able to catch, given the frequency of surf-able waves, other surfers and their skill
Safety,Can identify the visible dangers (rocks, currents) in the surf spot, the entry point and the exit point
Safety,Can assess if the waves in question are suitable to my level
Safety,Keep my board under control at all times, surfing or paddling, so I don't hurt anyone or myself with it
Safety,Can understand when I'm putting myself or others in danger, given my positioning regarding other surfers or the waves
Rules,Know the surf etiquette and respect other surfers in the water
Rules,Can see if i have priority or not
Rules,Know what a drop-in is
Rules,Know what snaking is
Rules,Know how to paddle to the peak, without interfering with other surfers
Waves,Already surfed green waves, but i was pushed into them by my surf instructor
Waves,Already surfed green waves and caught my own waves
Waves,Use reference spots on shore, to make sure i always return to/stay in the place I intend to surf (line-up)
Waves,Can see the wave coming and figure out whether it is a left, a right or a close-out
Waves,Can see the wave coming and guess where is it gonna break first
Waves,Can sit on the board when outside and quickly turn it to where i want to paddle next
Waves,When catching a wave, i first paddle to where i think the best spot to catch it is, not just to shore
Waves,When catching a wave, I keep my eyes on the wave the all time, checking the peak and down the line
Waves,Can identify if the take-off is going to be steep and fast or mellow and easy, and do it with the proper angle
Waves,While surfing, can look at the wave and predict what the wave is going to do next and adapt
Technique,Can do the take off, with the 3 steps, or jumping, consistently
Technique,Can do the take off, with the 3 steps, or jumping, consistently in steeper waves
Technique,Can take off looking at the wave and not down at the board
Technique,Can take off already preparing for the next move, not just trying to balance
Technique,Can bottom turn
Technique,Can top turn
Technique,Can Cutback
Technique,Can trim (generate speed)
Technique,Can duck dive
Technique,Can turtle roll
Equipment,Understand how different types of boards (size, shape, volume, etc.) influence my surfing
Equipment,Can choose an appropriate board for my skill level and the conditions available